{
  "contract": "design_profile",
  "version": "0.2.0",
  "produced_by": "design",
  "input_sha256": "53c7b9429fd04662a1de38d6bbe021e31510644bae7b92b442f5d33301b97f36",
  "brief_id": null,
  "consumers": [
    "stacking",
    "pipeline"
  ],
  "design_profile": {
    "profile_id": "baseline",
    "profile_version": "0.1.0",
    "registry_id": "spaceplan-design-registry",
    "registry_version": "0.2.0",
    "base_stores_sha256": "7a5b4646dc2d2e3015e64f5c2e4b71320a0f00e9cb549735e6bfe6c2fd5713ea",
    "changes": [],
    "note": "Baseline: no changes (registry defaults). Client profiles start from here."
  }
}
